<?xml version="1.0" encoding="UTF-8"?>

<!DOCTYPE help SYSTEM "C:\Users\S.Damian\Workspace\Development\AREasy3\AREasy\src\doc\help\action.dtd">

<!--
  ~ Copyright (c) 2007-2018 AREasy Runtime
  ~
  ~ This library, AREasy Runtime and API for BMC Remedy AR System, is free software ("Licensed Software");
  ~ you can redistribute it and/or modify it under the terms of the GNU Lesser General Public
  ~ License as published by the Free Software Foundation; either version 2.1 of the License,
  ~ or (at your option) any later version.
  ~
  ~ This library is distributed in the hope that it will be useful, but WITHOUT ANY WARRANTY;
  ~ including but not limited to, the implied warranty of MERCHANTABILITY, NONINFRINGEMENT,
  ~ or FITNESS FOR A PARTICULAR PURPOSE. See the GNU Lesser General Public License for more details.
  -->

<help inherits="action.xml">
	<options>
		<option key="login" type="string" description="Specifies a login name registered in Remedy. This option has 'username' alias."/>
		<option key="logins" type="list" description="Specifies a list of login names registered in Remedy. This option has 'usernames' alias."/>
		<option key="userfieldid" type="string" description="Specifies a field id from a specified form that will be used to identify an user account"/>
		<option key="userfieldvalue" type="string" description="Specifies the field value that will be used to create the qualification string that will be used to idenfy the user account"/>
		<option key="userqualification" type="string" description="Defines a custom qualification criteria to identify the user account"/>
		<option key="userform" type="string" description="Specifies the formname that will be used in order to define the structured qualification using 'userfieldid' and 'userfieldvalue' options. This option has 'userformname' alias"/>
		<option key="excludeusers" type="list" description="Defines a list of user account that could be excluded in case of the user list is returned dynamically, based on custom qualifications"/>
	</options>
</help>
