<?xml version="1.0" encoding="UTF-8"?>

<!DOCTYPE help SYSTEM "../action.dtd">

<!--
  ~ Copyright (c) 2007-2020 AREasy Runtime
  ~
  ~ This library, AREasy Runtime and API for BMC Remedy AR System, is free software ("Licensed Software");
  ~ you can redistribute it and/or modify it under the terms of the GNU Lesser General Public
  ~ License as published by the Free Software Foundation; either version 2.1 of the License,
  ~ or (at your option) any later version.
  ~
  ~ This library is distributed in the hope that it will be useful, but WITHOUT ANY WARRANTY;
  ~ including but not limited to, the implied warranty of MERCHANTABILITY, NONINFRINGEMENT,
  ~ or FITNESS FOR A PARTICULAR PURPOSE. See the GNU Lesser General Public License for more details.
  -->

<help>
	<name>Echo</name>
	<description>
Echo action is usually used to check if an AREasy server instance is running or not. If is running the server will return a log message having the following pattern:
"Echo message from AREasyHostName:AREasyPort"
	</description>
	<syntax>areasy -action echo [-signal] [-inout]</syntax>
	<options>
		<option key="inout" type="bool" defvalue="off" description="It is parameter that will print out as a log message all input parameters (from command line) and their values"/>
		<option key="signal" type="bool" defvalue="off" description="It is provided to the action to return a data value that is '0'. This parameter is usually used to check in real time system interoperability for complex AREasy configuration. As an example this method could be used be AREasy FILTERAPI module in order to send a real message to the Remedy server that AREasy is online and could process external calls"/>
		<option key="arsystem" type="bool" defvalue="off" description="Checks the connectivity to an AR System server"/>
	</options>
	<samples>
		<sample code="areasy -action echo" description="Checks server status and returns a log message"/>
		<sample code="areasy -action echo -signal" description="Checks server status and returns bit 0 as a value if the server is up (otherwise nothing) and server answer into a log message"/>
		<sample code="areasy -action echo -inout" description="Checks server status and returns input parameters as output value and server status as a log message"/>
	</samples>
</help>
