<?xml version="1.0" encoding="UTF-8"?>

<!DOCTYPE help SYSTEM "../../action.dtd">

<!--
  ~ Copyright (c) 2007-2020 AREasy Runtime
  ~
  ~ This library, AREasy Runtime and API for BMC Remedy AR System, is free software ("Licensed Software");
  ~ you can redistribute it and/or modify it under the terms of the GNU Lesser General Public
  ~ License as published by the Free Software Foundation; either version 2.1 of the License,
  ~ or (at your option) any later version.
  ~
  ~ This library is distributed in the hope that it will be useful, but WITHOUT ANY WARRANTY;
  ~ including but not limited to, the implied warranty of MERCHANTABILITY, NONINFRINGEMENT,
  ~ or FITNESS FOR A PARTICULAR PURPOSE. See the GNU Lesser General Public License for more details.
  -->

<help inherits="ars/data/basedata.xml">
	<name>Form Data Operation</name>
	<description>Execute data transactions through a dedicated AR form</description>
	<syntax>
		areasy -action formdata -operation insert|update|delete|merge
		-form FormName [-id EntryId] [-Q10001 Values1 .. -Q1000N ValuesN] [-qualification "'7'=1"]
		-D10001 Values1 .. -D1000N ValuesN
	</syntax>
	<options>
		<option key="operation" type="string" selvalues="insert,update,delete,merge" description="Indicates type of transactions: insert, update, delete or merge"/>
		<option key="id" type="string" description="Identify form record by Request ID/Entry ID (field with Id 1)"/>
		<option key="qualification" type="string" description="Identify form record based on a specific qualification"/>
		<option key="chunk" type="string" description="A set of records fetched through a search having less number of records than total search operation is considered a chunk. Chunk option is used only with qualification flag and will shift the search starting from specific what chunk number"/>
		<option key="nextchunkid" type="string" description="Works only in conjunction with qualification and chunk options and a Request Id to be considered in search condition for the next chunk"/>
		<option key="limit" type="string" description="Limits the search operation (and implicitly for data fetching) to to a number of records"/>
		<option key="mergematchingfieldids" type="string" description="Specify a list of fields that will be considered for data matching"/>
		<option key="mergevaliddata" type="bool" description="Run merge operation validating data before merge (e.g. to exist, etc.)"/>
		<option key="createifnotexist" type="bool" description="For update operation creates the record if doesn't exist"/>
		<option key="updateifexists" type="bool" description="For create operation updates the record if it is already registwered"/>
	</options>
	<samples>
		<sample code="areasy -action ars.formdata -form TestForm -Q1000 'Key' -D8 'Info' -D1001 'Blue Color' -D1002 123 -operation create -updateifexists" description="Creates a new entry in TestForm form but checking previously if it is already created checking in field '1000' the keyword 'Key'"/>
		<sample code="areasy -action ars.formdata -form TestForm -qualification ||'1000'='Key' AND '7' = 0|| -D8 'Info' -D1001 'Blue Color' -D1002 123 -operation update -createifnotexist" description="Updates an entry in TestForm form identifying it using a custom qualification search. In case the record(s) is/are not identified through the qualification it will be created"/>
		<sample code="areasy -action ars.formdata -form TestForm -id 10000038764 -D8 'Info' -D1001 'Blue Color' -D1002 123 -operation update -createifnotexist" description="Updates an entry in TestForm form identifying it using a specific entry id. In case the record is not identified (more exacly the entry id doesn't exist) it will be created"/>
	</samples>
</help>
