<?xml version="1.0" encoding="UTF-8"?>

<!DOCTYPE help SYSTEM "../../action.dtd">

<!--
  ~ Copyright (c) 2007-2020 AREasy Runtime
  ~
  ~ This library, AREasy Runtime and API for BMC Remedy AR System, is free software ("Licensed Software");
  ~ you can redistribute it and/or modify it under the terms of the GNU Lesser General Public
  ~ License as published by the Free Software Foundation; either version 2.1 of the License,
  ~ or (at your option) any later version.
  ~
  ~ This library is distributed in the hope that it will be useful, but WITHOUT ANY WARRANTY;
  ~ including but not limited to, the implied warranty of MERCHANTABILITY, NONINFRINGEMENT,
  ~ or FITNESS FOR A PARTICULAR PURPOSE. See the GNU Lesser General Public License for more details.
  -->

<help inherits="action.xml">
	<name>AR Password Manager</name>
	<description>
		This action is an ARS utility, designed to encrypt or to decrypt AR configuration keys and passwords. Please notice that this action needs connection to the server that manages that key or password.
	</description>
	<syntax>
		areasy -action password -operation encrypt|decrypt -key [KeyOrPassword]
	</syntax>
	<options>
		<option key="operation" type="string" selvalues="encrypt,decrypt" defvalue="" description="Execution mode or this action (encrypt or decrypt keys and passwords)"/>
		<option key="type" type="list" selvalues="field,system" description="Describe type of key that is manipulated: key for password field (this is the default value) and key for system operations"/>
		<option key="key" type="string" description="Key or password that will be applied to encryption or decryption procedure"/>
	</options>
	<samples>
		<sample code="areasy -action password -operation encrypt -key test" description="Encrypt 'test' string in ARSystem format to become a classic AR password"/>
		<sample code="areasy -action password -operation encrypt -key test -arserver ars1 -aruser Demo" description="Encrypt 'test' string in ARSystem format to become a classic AR password but with explicit connection to a particular ARS server (and not relaying on the connection details defined in general runtime configuration)"/>
	</samples>
</help>
