<?xml version="1.0" encoding="UTF-8"?>

<!DOCTYPE help SYSTEM "../action.dtd">

<!--
  ~ Copyright (c) 2007-2020 AREasy Runtime
  ~
  ~ This library, AREasy Runtime and API for BMC Remedy AR System, is free software ("Licensed Software");
  ~ you can redistribute it and/or modify it under the terms of the GNU Lesser General Public
  ~ License as published by the Free Software Foundation; either version 2.1 of the License,
  ~ or (at your option) any later version.
  ~
  ~ This library is distributed in the hope that it will be useful, but WITHOUT ANY WARRANTY;
  ~ including but not limited to, the implied warranty of MERCHANTABILITY, NONINFRINGEMENT,
  ~ or FITNESS FOR A PARTICULAR PURPOSE. See the GNU Lesser General Public License for more details.
  -->

<help>
	<name>Clean</name>
	<description>Clean action runs only in server mode and it executes garbage collector, removes temporary files, log files and also removes the cache objects.</description>
	<syntax>areasy -action clean [-olderthan 10|20|..(in days)] [-force]</syntax>
	<options>
		<option key="force" type="bool" defvalue="off" description="Force to remove all objects from the cache layer. Otherwise will remove only expired objects."/>
		<option key="olderthan" type="number" description="Specifies a period (in days) that will be considered to remove the log files and also the temporary files"/>
	</options>
	<samples>
		<sample code="areasy -action clean" description="Removes all expired objects from cache"/>
		<sample code="areasy -action clean -force" description="Removes all objects from cache"/>
	</samples>
</help>
