<?xml version="1.0" encoding="UTF-8"?>

<!DOCTYPE help SYSTEM "../../action.dtd">

<!--
  ~ Copyright (c) 2007-2020 AREasy Runtime
  ~
  ~ This library, AREasy Runtime and API for BMC Remedy AR System, is free software ("Licensed Software");
  ~ you can redistribute it and/or modify it under the terms of the GNU Lesser General Public
  ~ License as published by the Free Software Foundation; either version 2.1 of the License,
  ~ or (at your option) any later version.
  ~
  ~ This library is distributed in the hope that it will be useful, but WITHOUT ANY WARRANTY;
  ~ including but not limited to, the implied warranty of MERCHANTABILITY, NONINFRINGEMENT,
  ~ or FITNESS FOR A PARTICULAR PURPOSE. See the GNU Lesser General Public License for more details.
  -->

<help inherits="itsm/admin/baseenrollment.xml">
	<name>Remove Application Permission</name>
	<description>The action is part of AR System management tools and it has the main goal to remove a specific application permission for one or many users. Application permission and also login Ids are validated before to be processed</description>
	<syntax>
		areasy -action delapppermission -permission ApplicationPermissionName -login val -logins val1 val2 ... valN
			-skipvalidation -findusers -excludeusers
	</syntax>
	<options>
		<option key="permission" type="string" description="Indicates the application permission name (e.g. 'Incident User') to be deleted from user permission list"/>
		<option key="findusers" type="bool" description="In case the login ids are not specified the system can detect the whole list of user that have the specified permission name"/>
		<option key="excludeusers" type="list" description="In case the user will be detected and you want to exclude a static list of user this option can be helpful"/>
		<option key="skipvalidation" type="bool" description="Skip the validation of specified permission"/>
	</options>
	<samples>
		<sample code="areasy -action delapppermission -permission 'Incident User'" description="Delete all incident User permissions from the system related to all found users"/>
		<sample code="areasy -action delapppermission -permission 'Incident User' -login appadmin" description="Delete incident User permission associated to appadmin user"/>
	</samples>
</help>