<?xml version="1.0" encoding="UTF-8"?>

<!DOCTYPE help SYSTEM "../action.dtd">

<!--
  ~ Copyright (c) 2007-2020 AREasy Runtime
  ~
  ~ This library, AREasy Runtime and API for BMC Remedy AR System, is free software ("Licensed Software");
  ~ you can redistribute it and/or modify it under the terms of the GNU Lesser General Public
  ~ License as published by the Free Software Foundation; either version 2.1 of the License,
  ~ or (at your option) any later version.
  ~
  ~ This library is distributed in the hope that it will be useful, but WITHOUT ANY WARRANTY;
  ~ including but not limited to, the implied warranty of MERCHANTABILITY, NONINFRINGEMENT,
  ~ or FITNESS FOR A PARTICULAR PURPOSE. See the GNU Lesser General Public License for more details.
  -->

<help>
	<name>Stop</name>
	<description>
		Start action is used to stop the local AREasy server instance or a remote instance, or to interrupt the execution process of an active action that runs on a specific channel.
		In case of you want to stop a remote instance or an action from a remote instance you have to provide admin credentials (user credentials used to connect to the AR System instance).
	</description>
	<syntax>areasy -action stop [-host AREasyHost -aruser ARSystemUser -arpassword ARSystemPassword] [-channel ExecutionChannel]</syntax>
	<options>
		<option key="host" type="string" description="The host name or IP address where the AREasy server is running"/>
		<option key="aruser" type="string" description="Remedy account name referred by AREasy instance"/>
		<option key="arpassword" type="string" description="Password for Remedy account referred by AREasy instance. The password value could be plain text of obfuscated (encrypted)"/>
		<option key="channel" type="string" description="Execution channel number (i.e. 2) or channel name (i.e. areasy-2)"/>
	</options>
	<samples>
		<sample code="areasy -action stop" description="Stops local server instance or AREasy server instance that is specified in the configuration file"/>
		<sample code="areasy -action stop -host remedysrv.company.com -aruser Demo -arpassword 1234" description="Stops AREasy server instance specified in the command line"/>
		<sample code="areasy -action stop -channel 3" description="Interrupts execution of action that runs on channel 3"/>
	</samples>
</help>
