<?xml version="1.0" encoding="UTF-8"?>

<!DOCTYPE help SYSTEM "action.dtd">

<!--
  ~ Copyright (c) 2007-2020 AREasy Runtime
  ~
  ~ This library, AREasy Runtime and API for BMC Remedy AR System, is free software ("Licensed Software");
  ~ you can redistribute it and/or modify it under the terms of the GNU Lesser General Public
  ~ License as published by the Free Software Foundation; either version 2.1 of the License,
  ~ or (at your option) any later version.
  ~
  ~ This library is distributed in the hope that it will be useful, but WITHOUT ANY WARRANTY;
  ~ including but not limited to, the implied warranty of MERCHANTABILITY, NONINFRINGEMENT,
  ~ or FITNESS FOR A PARTICULAR PURPOSE. See the GNU Lesser General Public License for more details.
  -->

<help>
	<options1>
		<option key="action" type="string" description="Runtime action that must be specified in any command line and the action name (the values of this parameter) has to be registered in one of the configuration files (from runtime instance or server instance)"/>
		<option key="host" type="string" defvalue="localhost" description="AREasy server host name"/>
		<option key="port" type="number" defvalue="6506" description="AREasy server TCP/IP port"/>
		<option key="arserver" type="string" defvalue="127.0.0.1" description="AR System server name or IP address for direct connectivity"/>
		<option key="aruser" type="string" defvalue="Demo" description="AR System user name"/>
		<option key="arpassword" type="string" description="User password and value could be plain text of obfuscated (encrypted)"/>
		<option key="arrpc" type="number" description="RPC channel port"/>
		<option key="arport" type="number" defvalue="2300" description="TCP/IP port"/>
		<option key="armode" type="string" selvalues="base,overlay" description="Connectivity mode: base or overlay"/>
		<option key="priority" type="string" selvalues="min,norm, max" description="Sets the priority of the action execution channel. All possible values could be: min (low priority), max (high priority), norm (normal priority)"/>
		<option key="loglevel" type="string" selvalues="debug,info,warn,error" description="Sets logging level of the current action execution session: debug, info, warn or error"/>
		<option key="logformatter" type="string" description="Sets log format of the current action execution session"/>
		<option key="compactmode" type="bool" defvalue="off" description="It sends the data array from server to the AREasy client as a one data line (all values are concatenated in one line, separated by space character)."/>
		<option key="notification" type="bool" defvalue="off" description="Overwrites the standard configuration used to send the output data and the log messages via email. The recipients and all the other email details are specified in the configuration files or could be overwritten by the other parameters (see below). The notification body always will contain the data array generated by the action execution and the action log message. In case of you want to include only data or only the log message use -reportnodata and -reportnolog parameters (see below)"/>
		<option key="reportnodata" type="bool" defvalue="off" description="Ignores in the output message or in the notification body the data array generated by the action execution"/>
		<option key="reportnolog" type="bool" defvalue="off" description="Avoids appending to the output message or to the notification body the log messages generated by the action execution"/>
		<option key="asynchron" type="bool" defvalue="off" description="Launches the action on the server side and don't wait server answer. This parameter works only in client/server mode"/>
		<option key="help" type="bool" description="Displays action's help text. In case of other action than 'help' will use this option, instead of execute the action the runtime will return the help text of that action"/>
		<option key="helplevel" type="number" defvalue="0" description="Specifies if the help text to be generated from a specific level: 0 means only direct options, 1 include also additional options regarding action connectivity and environment, 2 will display also the options that maybe are not relevant for your action but provides all possible option ffrom connectivity and environment point of view"/>
		<option key="helpoptions" type="bool" defvalue="on" description="Prints out the help document containing all options related to the action that is called"/>
		<option key="helpsamples" type="bool" defvalue="on" description="Prints out the help document containing all samples related to the action that is called"/>
	</options1>
	<options2>
		<option key="notificationmailbox" type="string" description="Mailbox name from AR System Email Configuration. It overwrites notification details from AReasy configuration file regarding the mailbox name that will be used (defined in Remedy) to send the notification. So, this parameter could be used only if parameter -notification is specified"/>
		<option key="notificationrecipientto" type="string" description="TO Email address name(s). It overwrites the corresponding notification property from configuration file"/>
		<option key="notificationrecipientcc" type="string" description="CC Email address name(s). It overwrites the corresponding notification property from configuration file"/>
		<option key="notificationsubject" type="string" defvalue="AREasy Runtime Notification" description="Email Subject notification. It overwrites the corresponding notification property from configuration file"/>
		<option key="notificationaction" type="string" description="Submitted notification status (by default is 'Yes', waiting for Remedy server to deliver submitted notification)"/>
		<option key="arremoteserver" type="string" description="Remote AR System server name or IP address referred by AREasy instance"/>
		<option key="arremoteuser" type="string" description="Remote AR System user name"/>
		<option key="arremotepassword" type="string" description="Password for Remote user"/>
		<option key="arremoterpc" type="number" description="RPC channel port for Remote server"/>
		<option key="arremoteport" type="number" description="TCP/IP port for Remote server"/>
		<option key="arremotemode" type="string" selvalues="base,overlay" description="Remote connectivity mode: base or overlay"/>
	</options2>
</help>