<?xml version="1.0" encoding="UTF-8"?>

<!DOCTYPE help SYSTEM "../../action.dtd">

<!--
  ~ Copyright (c) 2007-2020 AREasy Runtime
  ~
  ~ This library, AREasy Runtime and API for BMC Remedy AR System, is free software ("Licensed Software");
  ~ you can redistribute it and/or modify it under the terms of the GNU Lesser General Public
  ~ License as published by the Free Software Foundation; either version 2.1 of the License,
  ~ or (at your option) any later version.
  ~
  ~ This library is distributed in the hope that it will be useful, but WITHOUT ANY WARRANTY;
  ~ including but not limited to, the implied warranty of MERCHANTABILITY, NONINFRINGEMENT,
  ~ or FITNESS FOR A PARTICULAR PURPOSE. See the GNU Lesser General Public License for more details.
  -->

<help inherits="itsm/admin/baseenrollment.xml">
	<name>Support Group Administration</name>
	<description>
		This action is an ITSM utility, designed to create or update support groups and to manage their members and related details.
	</description>
	<syntax>
		areasy -action supportgroupadmin
	</syntax>
	<options>
		<option key="runcondition" type="string" description="Describes the Velocity condition to allow the execution of action's operation. The evaluation is performed before action operation and contains a context with all input parameters and read attributes  for the particular CoreItem instance processed by the requested operation"/>
		<option key="operation" type="string" selvalues="setentity,setmembers,delmembers,setfrole,delfrole" defvalue="setentity" description="Execution mode or this action"/>
		<option key="sgroupcompany" type="string" description="Current support group company. In addition the action supports another alias for this option: supportgroupcompany"/>
		<option key="sgrouporganisation" type="string" description="Current support group organisation. In addition the action supports another alias for this option: supportgrouporganisation"/>
		<option key="sgroupname" type="string" description="Current support group name. In addition the action supports some aliases for this option: sgroup, supportgroup, supportgroupname"/>
		<option key="sgroupid" type="string" description="Current support group id. In addition the action supports some aliases for this options: supportgroupid"/>
		<option key="role" type="string" description=""/>
		<option key="apcode" type="string" description="applicationcode"/>
		<option key="status" type="string" description=""/>
		<option key="alias" type="list" description=""/>
		<option key="default" type="bool" description=""/>
		<option key="supportstaff" type="bool" description=""/>
		<option key="findusers" type="bool" description=""/>
	</options>
</help>
